id,body,date_posted,post_id,parent_id,sentiment_label,entities
15291,Taking 203 this semester and its not fun at all. Very frustrating at times. But its not a huge time sink and really not all that difficult. I just think the way its taught makes it a lot more difficult than it needs to be.,2/15/23,2339,-1,-1,
15292,"They're all not that bad and there are abundant resources. In most classes as long as you're top 40-45% you get an A-. It really depends on your objective tho. If you want to have a solid foundation, take all your classes here.",2/14/23,2339,-1,1,
15293,"I'm taking EECS 203 (Discrete) right now, I took Math 214 (Applied Linear Algebra) last semester, and I took Calc 3/Diff Eq at a community college in high school.

My experience:

Math 214:

\- Not well taught (largely due to my prof being 75 years old and well-passed his teaching prime, I've heard better things about other profs)

\- Not well organized but not terribly difficult

\- Interesting projects where we got to apply linear algebra concepts to our interests (most of the course were CS/Data Science/other engineers)

\- The nice thing about Michigan is that is there are (at least) 5 different linear algebra courses you can take, some of which are more proof-based/theoretical and others more applied (similar to AP/CC courses).

\- Other courses (namely math 217 which is the proof-based lin alg class) are known for being on the more difficult side but very valuable if you plan on taking any other math courses

EECS 203:

\- While EECS 203 is notoriously pretty difficult, I've found that the instruction is top notch. I've been to/watched lectures with all three current profs and they all seem very knowledgable and willing to help.

\- The class size is on the larger end (over 500 students pretty sure) and all sections are taught by one team (as opposed to other courses where each prof does it differently). This structure makes it much easier to answers to questions, find course info, etc.

\- Overall I'd say 203 is a great course (though difficult) and there's not really a reason to not take it at Michigan. As others mentioned, I'd be surprised if you can find a CC that has a discrete math course, let alone one that would be accepted for credit by Michigan.

Calc 3/Diff Eq:

My roommate was in Calc 3 last semester and is in diff eq this semester so I've seen a lot of what the courses are like at Michigan. The biggest difference I've seen content-wise is just a bit more depth of concepts/extra complexity on homework problems. Also similar issues to what I mentioned about 214 (mediocre instruction and lack of organization).

&#x200B;

Overall, I would say that you absolutely do not need to rush into taking Calc 3/Lin alg/Discrete before coming to Michigan and that taking them here will not be the worst thing ever (though a lot of people might make them out to be the worst classes ever). These courses are going to be some of the most challenging courses you take, regardless of where you take them. The biggest difference is that you might get better instruction/course organization at a CC, but you'll definitely learn more at Michigan.

The last thing I'd say is that being able to take Calc 3/Diff Eq in high school was probably the single most valuable thing I did in HS simply because the courses allowed to me get an idea of what college courses are like and how to teach myself content (which you'll have to do at any college and basically any course). Your first college-level math class is going to be a struggle simply as a result of the workload and difference in instruction compared to HS.

If you have any other questions/want more clarity on anything feel free to ask. :)",2/14/23,2339,-1,-1,
15294,"Discrete Math (EECS 203) is fine. I took it during high school (dual enrollment) and could have tried to transfer it over but I decided to retake it. No regrets. The instructional quality was so much better and the professor (Bodwin) was really good. 
Yes it was difficult, but it’s not too bad (I ended up with a borderline A) and you’ll need that preparation for 376 anyway. Also rumors say they’re making it easier (again) next semester.

Now with calc.. PLEASE take it in a community college and transfer credits over 😭",2/14/23,2339,-1,1,
15295,"I mean the math kinda sucks here, but it doesn’t mean it’s like bad. I’m taking discrete math, and it does suck, but I think most of the backlash is due to how hard the difficulty is. Calc is hard. Lin Alg is hard. Discrete math is hard.

Calc and Lin Alg you can take at cc or something if you want. Sure. I’d recommend probably taking like calc 3 and 4 over the summer at cc or something, but taking Rob 101 or Math 214 for Lin Alg should be fine. I’d be hard pressed to find a place that UMich would take their discrete math class, as it isn’t really offered at CC and UMich doesn’t take almost all universities discrete.",2/14/23,2339,-1,-1,
15296,"EECS 203 (discrete math) in FA21 made me realize I only liked math in high school because I was given numerous examples of how to solve the problems, and I just needed to plug in numbers. I spent more time writing in discrete math than my english class that semester. I am currently in EECS 376 (foundations of CS, aka discrete math 2), and it makes me want to curl up in a ball. 

CHEM 262 (calc 3, linear algebra, and dif eq for physical sciences) in FA22 was the first class that made me tear up. I am not sure about calc 3 and lin algebra as individual classes though. 

For context, I had a pretty strong background in math from high school (math team captain, 5 in AP calc, dubbed the “math wiz”), but it didn’t stop me from doing a 180 and disliking math here. My only advice for freshman is to not take math here.

tldr: take math at a community college unless you are a stubborn masochist like I am",2/14/23,2339,-1,-1,
15297,"From what I've heard, Discrete Math has made enormous improvements to its quality of instruction since I took it in 2016. I remember there being a policy around 2020 that ""anything short of pictures of your homework"" was considered honor code-compliant collaboration for the purposes of the class, and I expect that a similar policy should remain in place now.

There are several different linear algebra classes to take depending on your major or specialty, some of which are much harder than others. I'd recommend just taking whatever your advisor recommends. I honestly wish that I'd just taken Math 214 instead of attempting Math 217 and taking two tries to pass Math 419.

I remember Calc 3 being basically fine. No real complaints.",2/14/23,2339,-1,1,
15298,Hows 376? Should I take it with 281?,2/15/23,2339,15294,0,
15299,Henry Ford can transfer 203 but absolutely do not do it. 203 has improved massively and the concepts are extremely valuable and applicable to future courses.,2/14/23,2339,15295,1,
15300,The 376 struggle is real💀,2/14/23,2339,15296,-1,
15301,BIG thanks for help,2/14/23,2339,15296,1,
15302,tysm,2/14/23,2339,15297,1,
15303,"281 + 376 is fine. It’s similar to 203 + 280, one being coding based and one theory based so a good balance imo. Just avoid 281 + 370 unless you enjoy (for some reason) having two massive project deadlines on the same week",2/15/23,2339,15298,1,
15304,I’m dying rn,2/15/23,2339,15298,-1,
15305,How much harder is it compared to 203/280?,2/15/23,2339,15303,0,
15306,"281 vs 280: Roughly similar in difficulty except that projects now get graded on efficiency. Workload is a lot heavier though. (probably double or triple 280)

376 vs 203: Significantly harder imo. Workload is similar.",2/15/23,2339,15305,0,
15307,Rough. Guess I’ll put off 376 until my last semester,2/15/23,2339,15306,-1,
15592,I went to MSU before I came here. This was so sad and it made me a little teary eyed.  I was fortunate that none of my friends were on campus and all went home early that day. I am a little surprised there was no statement from Ono.,2/14/23,2356,-1,-1,
15594,"Typically, are there copycat shootings nearby? I am personally a bit worried about going to campus tomorrow (Tuesday) but not sure if that fear is unfounded",2/14/23,2356,-1,-1,
15597,My brother was there locked in a basement for 4 hours. This was so scary,2/14/23,2356,-1,-1,
15599,does anyone know if is there anything we can do to support the victims? do we just donate blood so it’s ready for the *next* time?? wait to support the gofundmes for their medical bills?? I feel so helpless. this is heartbreaking.,2/14/23,2356,-1,-1,
15603,Gunman just confirmed suicide.,2/14/23,2356,-1,0,
15604,Pray for our brothers and sisters in EL. Tonight we’re all Michiganders,2/14/23,2356,-1,1,
15605,Is there any suspects in custody?,2/14/23,2356,-1,0,
15606,Please please please only spread the information that has been released from an actual source (MSU PD) and not just whatever you heard on the scanners. Misinformation has been terrible the last few hours,2/14/23,2356,-1,-1,
15607,Sounds like it might be over finally,2/13/23,2356,-1,1,
15608,This is so heartbreaking. Why do we as a country continue to accept this? Hope all stay safe,2/13/23,2356,-1,-1,
15609,Bro this shit is fucked up man 🤦‍♀️ these are actual human lives bro like wtf,2/13/23,2356,-1,-1,
15610,[removed],2/13/23,2356,-1,0,
15611,[removed],2/13/23,2356,-1,0,
15612,Reports of trucks unloading explosives and shots at like 8 different places simultaneously.  Either this is a serious team doing this shit or someone is trolling 911,2/13/23,2356,-1,-1,
15613,Bomb threat has also been made,2/13/23,2356,-1,0,
15614,[removed],2/13/23,2356,-1,0,
15615,"Fucking hell. Stay safe, Spartans.",2/13/23,2356,-1,-1,
15616,This is heartbreaking. 😢,2/13/23,2356,-1,-1,
15617,"At least one source, MSU student newspaper 

https://statenews.com/article/2023/02/shots-fired-near-berkey-hall",2/13/23,2356,-1,0,
15618,"As someone from East Lansing, this is absolutely horrifying.

The only country in the developed world where we let this shit happen.",2/13/23,2356,-1,-1,
15619,Reach out to your Spartan friends. This week is going to be tough for them.,2/13/23,2356,-1,1,
15620,"Areas include Berkey Hall, Union Hall, and possibly Phillips and Snyder right now.",2/13/23,2356,-1,0,
15621,Supposedly up to 14 wounded. This is a huge incident,2/13/23,2356,-1,0,
15622,"https://m.broadcastify.com/listen/feed/34012

This is the police scanner if anyone wants to listen.",2/13/23,2356,-1,0,
15623,[deleted],2/14/23,2356,15592,0,
15624,"You are right - it is still unlikely to happen here, but the likelihood of it happening in the next couple of days is higher than usual. Just remain vigilant and always have an exit plan for any University buildings you might be in. I don't think it is necessary to skip school today, but you can do that if you want.",2/14/23,2356,15594,0,
15625,"You are not alone, I think faculty and staff will be just as shaken and have the same fears. We are all going to be mentally fatigued today.",2/14/23,2356,15594,1,
15626,The only thing to do is work for change.  Our ridiculous gun laws need to change.,2/14/23,2356,15599,-1,
15627,https://twitter.com/msupolice/status/1625366344899100672?s=20&t=jeYJA1Es8Unveeyzm1sAtA,2/14/23,2356,15603,0,
15628,Source: https://1090thepatriot.iheart.com/content/2023-02-13-michigan-state-shooting-suspect-dead-report/,2/14/23,2356,15603,0,
15629,unconfirmed but it’s looking like the coward shot himself and police approached,2/14/23,2356,15605,-1,
15630,did they catch the shooter ?,2/13/23,2356,15607,0,
15631,Something needs to change.,2/14/23,2356,15608,0,
15632,"Politicians on the take (all of them) like to put corporate interests over humanity. System is fundamentally flawed and it won’t change in our lifetime but maybe, if we’re really really lucky, nuclear winter will come and maybe the next species to evolve intelligence will do it better than we did.",2/14/23,2356,15608,-1,
15633,[There are not multiple shooters. ](https://twitter.com/Phil_Lewis_/status/1625346206862901249?t=x2skCnmKonwO0AZ4cwgKQw&s=19).,2/13/23,2356,15610,0,
15634,Wtf is wrong with you? You’re a real POS.,2/13/23,2356,15611,-1,
15635,Not appropriate man,2/13/23,2356,15611,-1,
15636,"Listening to the police scanner, calls would come in about shots fired, cops at the location of the reported shooting would say there were no shots being fired.  Seems like people are trolling the cops during this whole thing.",2/13/23,2356,15612,0,
15637,"Who is saying that? *The Lansing State Journal* is currently reporting [Michigan State releases description of suspect in reported shootings](https://www.lansingstatejournal.com/story/news/local/2023/02/13/msu-police-order-students-staff-to-shelter-in-place-for-shots-fired-report-run-hide-fight/69901195007/), updated two minutes ago, and mentions only a single shooter. Not saying you or other sources are wrong, this is obviously a developing story, I'm just curious about your sources.",2/13/23,2356,15614,0,
15638,"I am from a developing country, never happened",2/14/23,2356,15618,0,
15639,Sadly this is no longer true. We just do it more often,2/13/23,2356,15618,-1,
15640,">The only country in the developed world where we let this shit happen.

So glad that news spread so quickly. I was able to confirm that all of my family and family friends were at home within 10 minutes of the first shots fired.",2/13/23,2356,15618,-1,
15641,Imagine the Oxford HS students who graduated and then went to MSU. Two shootings in less than 2 years to deal with. I bet there’s at least a few dozen. I can’t even begin to imagine what they’re going through right now,2/13/23,2356,15619,0,
15642,"It’s surreal to think of MSU Union, a place I’ve met friends, a place I’ve gotten ice cream, as a place that someone was just shot and killed",2/14/23,2356,15620,-1,
15643,I live in sny phi our dorms were hit by the swat team,2/14/23,2356,15620,0,
15644,Possibly Bessey Hall now,2/13/23,2356,15620,0,
15645,Update Akers Hall and/or Hubbard Hall,2/13/23,2356,15620,0,
15646,"[Five victims, one death](https://twitter.com/greg_price11/status/1625347027524628482?t=DCRwelwyJwnPYB8BnrWP8g&s=19)",2/13/23,2356,15621,-1,
15647,"It’s been going on for three hours. Suspect is not in custody. 
I graduated MSU last spring and I have friends on campus currently hiding.",2/13/23,2356,15621,0,
15648,Source?,2/13/23,2356,15621,0,
15649,I walked that campus at night almost every day for 4 years. Had my circumstances been a little different I could have still been there for a gap year. I lived in the dorm right across the street from the Union so I am very familiar with the areas impacted. I had a dream last night I was still at MSU and some nice people pulled me off the street and into Berkey Hall to shelter in place for a shooter.,2/14/23,2356,15623,0,
15650,This. I have quizzes today but my brain is so scrambled honestly.,2/14/23,2356,15625,-1,
15651,That ass took couple lives with him and injured couple others ugh.,2/14/23,2356,15629,-1,
15652,Self inflicted gunshot it sounds like,2/14/23,2356,15630,0,
15653,[deleted],2/14/23,2356,15632,0,
15654,Listen to the actual police scanner. The police on the scanner are saying something totally different compared to this announcement.,2/13/23,2356,15633,0,
15655,What did he say?,2/14/23,2356,15635,0,
15656,Trolling or they just don’t know what gunshots actually sounds like.,2/13/23,2356,15636,0,
15657,Wtf kind of people would  do this when people are being murdered ? I hope they figure that out later and deal with them,2/13/23,2356,15636,-1,
15658,[removed],2/13/23,2356,15637,0,
15659,Glad all is safe but /r/unnecessarilyquoted,2/14/23,2356,15640,1,
15660,i saw a post and it was like a sandy hook survivor also experienced this yesterday. bffr america.,2/14/23,2356,15641,0,
15661,i didn’t even think about that. that’s heart wrenching. this is so close to home it has me sick to my stomach.,2/13/23,2356,15641,-1,
15662,My Monday night routine is go to the union after my evening class. It was canceled yesterday because my prof was sick and that inadvertently kept me safe last night,2/14/23,2356,15642,0,
15663,Hope they stay safe,2/14/23,2356,15647,1,
15664,"**Live post in r/michigan:** https://www.reddit.com/r/Michigan/comments/111qn3d/shots_fired_on_msu_campus_students_instructed_to/j8g9b0q/

**Live on youtube:** https://www.youtube.com/watch?v=xKqP5NOYi1M

**Live police scanner:** https://m.broadcastify.com/listen/feed/34012",2/13/23,2356,15648,0,
15665,the police scanner feed someone else posted. People have died.,2/13/23,2356,15648,-1,
15666,Take care of yourself today ❤️,2/14/23,2356,15650,1,
15667,"I just heard and I’m glad he did, anymore fatalities would have been worse than it already is… I can’t imagine what kids at msu are going through right now. imagine coming back from class on a sunny day only to get shot by a psychopath you’ve never even seen before",2/14/23,2356,15652,0,
15668,it’s all of them. maybe not Bernie,2/14/23,2356,15653,0,
15669,"That announcement came from the cops, who are giving a press briefing. And the MSU police released photos of the suspect. Singular. Multiple law enforcement are reporting only one.",2/13/23,2356,15654,0,
15670,That MSU had a track record for this sort of thing and asking what UM’s was,2/14/23,2356,15655,0,
15671,"I think in most cases the callers are not intentionally reporting false information. People panic in situations like this, and are hypersensitive to anything they hear or see, not knowing what might be significant or not. Their minds fill in the blanks with details they may not have exactly witnessed.

UM had a report of a shooting on campus a few years ago. Once the initial call came in and the alert went out to the community, the Ann Arbor police scanner was inundated with more calls from people all over campus and town who reported seeing a male in a trench coat walking around with a long gun. No such shooter existed, and no shooting ever occurred. The gunshots the original caller thought they had heard in Mason Hall had been balloons popping.",2/13/23,2356,15657,0,
15672,"Appreciate it. Details are often mistaken as events are unfolding, including from police who are reporting what they heard, so you never know what's right until the dust settles. After the big Texas school massacre, corrections to even official public statements by police were coming out for weeks after the incident.",2/13/23,2356,15658,0,
15673,I’m not saying I’m right I’m just saying that that’s what’s being said,2/13/23,2356,15658,0,
15674,I’m glad you were not there. Stay safe. And I am sorry that you and all your classmates had to go through that.,2/15/23,2356,15662,1,
15675,[removed],2/13/23,2356,15664,0,
15676,Someone in one of the /r/Michigan posts said already 3 confirmed dead. Hopefully that number doesn't get any higher.,2/13/23,2356,15665,1,
15677,"Tbh the quicker ending is better than giving a fair, slow, delayed trial over years to confirm that it was in fact the person holding the firearm, matching the description, who on video...did it and to give them a life sentence at our expense. To say nothing of the people who witnessed it having to relive it on the stand.",2/14/23,2356,15667,0,
15678,"this happens so much it’s so hard to keep normalizing it but I know this will be another event kept as a stat and moved on from in the next few months, and students will be told to get back to class and there will be minimal social resources to avoid liability for the traumatized kids that get depressed from this shit.",2/14/23,2356,15667,-1,
15679,Good point. Thank you for pointing that out. I hope it’s that. And Actually there was the incident at UM a few months ago but ended up being nothing. Is that the one you mean?,2/13/23,2356,15671,1,
15680,"yeah, don’t rlly care about down votes I hope it brings atttemtion to my comment at least . everyone nearby should keep listening to police broadcast, phone servers are extremely overloaded and news is being delayed .",2/13/23,2356,15672,0,
15681,Not a good time bot,2/13/23,2356,15675,-1,
15682,"The one I am referring to happened in March 2019. [Here](https://www.mlive.com/news/ann-arbor/2019/03/active-shooter-scare-at-university-of-michigan-stemmed-from-team-building-exercise.html) is an article about it. Thankfully nothing happened, but I will never forget how scary that afternoon was.",2/13/23,2356,15679,-1,
15683,"Yeah, those reports sound unlikely, as most mass shootings in the US are solo affairs, but you never know. I wouldn't worry about the downvotes either; reddit karma works out over time if you post with good intent.",2/13/23,2356,15680,0,
15684,"everyone should use whatsappp to call their loved ones right now to let them know they’re safe. normal phone calls are very overloaded, me and my sister were unable to call my family on iMessage",2/13/23,2356,15680,1,
15685,So scary! There was one last year as well. I feel so awful for the msu community rn.,2/13/23,2356,15682,-1,
15686,"yes it’s very hectic information spiraling right now. it’s confirmed that there was one short black male shooter with a baseball cap and Jean jacket but they haven’t caught him, but people from the school are posting saying that there’s no way a single shooter managed to shoot that much people in such little time. but also sources are only saying st least 5 people were shot. Some people are claiming bombs, others are claiming it’s all prank callers… I don’t know",2/13/23,2356,15683,-1,
17039,"you know it's bad when it's 2 hours before the hw's due and there's about 100 people sitting in the ugli basement waiting for the singular IA to pop them off the queue

tbf this group hw was a little bit mean though",2/6/23,2494,-1,-1,
17042,"Just looked at it, and yup, that was the last part of Project 2 when I took it",2/7/23,2494,-1,0,
17043,Was pretty deadly ngl,2/7/23,2494,-1,0,
17046,Skill issue,2/6/23,2494,-1,-1,
17048,prof Beaumont apologized to the class today for the difficulty LMAO,2/7/23,2494,-1,-1,
17049,Well now I am terrified. Current taking 203 and 280,2/7/23,2494,-1,-1,
17051,I mean it was literally a whole project assigned as groupwork so I get it lol,2/7/23,2494,-1,0,
17052,WTF is this? I took 370 in fall21 and there is no “group work”,2/10/23,2494,-1,-1,
17053,[deleted],2/6/23,2494,-1,0,
17054,"whining is a sin

EDIT: ☝️

EDIT2: 🧠🤣🫀🫁

EDIT3: retroactive 👹 (except for you, merely 🥒)",2/6/23,2494,-1,-1,
17055,That was me!! 30 ppl on the queue at 930 :/,2/7/23,2494,17039,-1,
17056,Lmao i wish i was there,2/7/23,2494,17039,0,
17057,💀💀💀,2/7/23,2494,17043,0,
17058,"I think the issue was we didn’t articulate the difficulty well enough, we’ve assigned that question for the past 20ish years",2/8/23,2494,17048,0,
17059,gotta pass 280 and 203 first 🙏,2/7/23,2494,17049,0,
17061,"It wasn’t a hard assignment, I started at 10:30 and got full points by 11:30. I tried that with 280 project 4 and got 50%",2/7/23,2494,17049,0,
17063,Don’t be scared!!! If you can get through 280 you can get through 370 👍🏻,2/7/23,2494,17049,1,
17065,Just bomb that part of hw and it's just less than 2% of your grade.,2/7/23,2494,17049,-1,
17066,"it takes 15 minutes to read the instructions, 15 minutes to get the code mostly working, and somewhere between 15 minutes and 15+ hours to fix all the bugs",2/6/23,2494,17053,0,
17068,no i dont think you do,2/7/23,2494,17056,0,