id,body,date_posted,post_id,parent_id,sentiment_label,entities
7555,"congrats on passing!!!!!!! this is something to celebrate, even if the grade isn’t what you wanted.",12/24/22,1004,-1,1,
7559,bro…relax,12/24/22,1004,-1,-1,
7561,"I had the same problem coming in as a freshman in 2019. Top 10 in my public school!! Then I got here and fell of significantly. I used to get upset when ppl told me this but C’s truly do get degrees. I believe in you, umich has a difficult curriculum and the fact that you passed is wonderful. You’re doing amazing!!",12/24/22,1004,-1,1,
7562,"Well, can’t give ya comfort because I think that would perpetuate your mindset. But I’ll give you some advice. 1. Your identity and your performance at school at 2 disparate entities. 2. Your school performance and your general intelligence capabilities are also two disparate entities. 

When you look at school performance for what it is, you realize that the things you probably care about aren’t actually related to it",12/24/22,1004,-1,1,
7563,"Grades don’t really matter. I graduated years ago, I’ve never had GPA on my resume and no one has ever asked for it. You good, don’t let it ruin your holiday",12/24/22,1004,-1,1,
7564,"not in eecs but astrophysics & ive gotten loads of Cs 

passing hard classes at umich is an accomplishment in itself! it definitely feels bad at first but you’ll forget about it once you start more classes. i’m not ashamed to admit my gpa isn’t that high because passing and learning is more important (even for someone who needs grad school). show improvement and determination",12/24/22,1004,-1,1,
7565,"The same exact thing happened to me in Chem 215 this semester. You passed the class. Time goes on🤷‍♀️ It feels like absolute shit, but letting a couple weeder classes tank your self-esteem is in no way helpful in terms of achieving your goals.",12/24/22,1004,-1,1,
7566,"Had a 3.91 before this semester and took 280 and 203, failed 203 and barely passed 280. Absolutely Tanked my GPA. It’s ok, we all have rough semesters. All that matters is that we bounce back next semester and know that academics don’t define us",12/24/22,1004,-1,1,
7567,"281 is one of the hardest classes you’ll take as a CS major, but don’t worried it gets better from here. I got a C in 281, & a C- followed by a C in 370. However these weed out classes don’t define you as a student.

From here on, you take upper levels, where the assignments are much more specialized & fun. I went from the grades I mentioned, to A’s in 442, 485, 692 & other classes. I’ve had internships 2 FAANG internships, & even got into Grad School with a 3.3 GPA.

You are meant to be here, you were accepted for a reason, and be wary of imposter syndrome like is mentioned in every class. Trust me, you’re on your way up, & all that matters is you try to figure out how to become a better test taker.

I went from being around or below average on exams, to above average in grad school. The difference? After undergrad I took a seriously look at how I was studying & changed it.

If you have any questions, feel free to dm me. Congratulations on passing & you’ve got this!",12/24/22,1004,-1,1,
7568,I got C’s in both semesters of a core course in my major when I was an undergrad. I am now a professor of that major. Just keep at it!,12/24/22,1004,-1,1,
7569,I got a c+ in fortran and that’s okay because my classmate did all the work on our project. Engineering and computer science classes are much harder than liberal arts courses. Believe me I know. I had a 2.2 gpa as a freshman taking engineering prerequisites abd switched to history where I had a 3.6 gpa in my major.,12/24/22,1004,-1,-1,
7570,"I didn’t do CS but have similar story. 

I graduated near top of my class with my BSE  and rolled that into my MSE in aero. Not sure what class it was for my MSE but i completely bombed everything. Homework…bombed. Tests…. bombed. Shock to my system because I had never gotten below say a 70 on a test and I was looking at a 40 in the class or something.  It was like a foreign language. Somehow got a passing grade and moved on. 

Been in industry for 10+ years now, feel like I’ve been very successful. Changed industries but that was by choice. 

Obviously I still remember this ordeal so it left it’s emotional mark. But that’s it.",12/24/22,1004,-1,1,
7571,"Same bro, just got an internship offer 2 days ago. Even though I may not be cut for computer science I am gonna just do it anyways. I’d say just keep grinding. At the very least I’d say the fact that you even passed this class means you’ll likely walk out of college with a full time job in cs. I felt the same way for a little bit but now I’ve just accepted and moved on from my grade, though I still feel like if I had started the projects earlier maybe I would have done better lol.",12/24/22,1004,-1,1,
7572,Bro I didn't get a grade above C my first two years at Michigan,12/24/22,1004,-1,-1,
7573,"You’ll look back at this post, or just experience in general with EECS 281 and laugh about it. GPA doesn’t really determine whether you get into the top companies or any company for that matter in our industry. What matters is do you understand the material? Do you know how to assess a CS problem with respect to date structures and algorithms (important for those technical interviews). Do you know how to implement a project from spec details? Do you know how to play well with teammates (more of an EECS 280 thing but you get my point). All these things are more important than that letter grade. Enjoy your break and be happy you’re one of the few that can say I BELONG in the CS program at The University of Michigan!",12/24/22,1004,-1,1,
7574,You are not your grades.,12/23/22,1004,-1,0,
7575,"After you graduate you will be hired and making money, living  and enjoying life, and none of this will matter.  The stuff they throw at you in UM CS is diabolical, stuff you will most likely never see again. Hopefully it just makes you battle tested, deepens your understanding of what is possible, fills your toolbox with solutions, and teaches you how to use every resource you can find to devise a good solution to the problems that come your way. For most business applications, your knowledge is already better than most in the field. 

As far as your path in life, I guess it all depends on what you do, but I don't think yours if permanently changed because of this.  Or if it is, maybe the one you thought wasn't really a great fit after all.  Be kind to yourself, getting through that class is an accomplishment.   

class of '93",12/23/22,1004,-1,1,
7576,[deleted],12/23/22,1004,-1,0,
7577,C's get degrees (and jobs) my dude,12/23/22,1004,-1,1,
7578,https://www.reddit.com/r/pics/comments/7gp11d/this_vanity_tag/?utm_source=share&utm_medium=ios_app&utm_name=iossmf,12/23/22,1004,-1,0,
7579,"By definition a C grade is passing and indicates adequate performance in the course. Getting a C grade in EECS 281 therefore means you ARE cut out for UM Computer Science. Also consider that 281 is widely regarded as one of the hardest CS courses in the whole CS department. You did great, you didn't need a retake, you can move forward towards upper level CS and never look back. Be proud of yourself.",12/23/22,1004,-1,-1,
7580,"It can be pretty tough getting your first low grade, especially when you’ve done well in all your classes your whole life. But it’s going to be ok and your academic career is not ruined. Umich engineering can be quite unkind to GPAs but that’s not a knock on your aptitude to the field. I believe I got a C in differential equations my freshman year. I was worried I wasn’t going to pass but I did. Everything ended up being fine. I managed to graduate cum laude and got a job in the field of my major.",12/23/22,1004,-1,1,
7581,"You passed the class! That means that the professors do believe that you did enough to show competence and move forward with the computer science curriculum. Not to mention, that you got an A average on the projects which is no small feat! IMO exams, especially ones where you have to write code with pencil and paper, aren't as good as a measure of your computer science ability. They need some way to test you, but it doesn't really well translate to real-world programming with how you can just Google everything.  

281 is not an easy class. It's a big step up from 280, and depending on what upper levels you take, it could very well be the hardest CS class you take at Michigan. There are definitely harder classes (such as 482) that can continue to push you, but in general, I feel like the difficulty of the CS program starts to plateau after 281. The other thing is that when there's a big increase in difficulty between classes, not everyone can excel on the first try because people learn different things at different rates. One of my 281 IAs didn't do well in the class himself but was able to pick up the skills later and well, was able to be competent enough to be an IA while he was still a student.   

Also, GPA is honestly pretty overrated. Most employers don't care nearly as much as you think, especially once you graduate. Grad schools care to an extent, but less so for PhDs and it can be made up in other ways, especially if you have strong research experience or choose to spend time in industry first. It can be easy to forget that Michigan Computer Science is a very good, yet tough program, so just being able to get through it means a lot to companies. I've had friends with lower GPAs (even below 3) that still ended up working at great tech companies and are super happy with their lives now.  

So congrats on passing the class! That's definitely something not everyone can do. And please don't be deterred by your grades, every successful person faces setbacks. I'm sure your future is bright and I wish you the best of luck on the rest of the cs program. You got this!",12/23/22,1004,-1,1,
7582,"I strongly strongly recommend watching this video  
[https://www.youtube.com/watch?v=LvDlwmNo-hw&t=614s](https://www.youtube.com/watch?v=LvDlwmNo-hw&t=614s)

This guy got a C+ in EECS 281 and a C in EECS 370, but then he ended up working at amazon and had 3 internships during college. If he is cut out for computer science, i don't see why you are not",12/23/22,1004,-1,1,
7583,"You passed the class, you’re cut out for eecs here",12/23/22,1004,-1,1,
7584,what tf do you think i’m trying to do,12/24/22,1004,7559,-1,
7585,Chill bud. Having high standards and goals for yourself is a good thing because it motivates you. Aiming for perfection and falling to above average is much better than trying to sneak by and ending up “good enough”.,12/24/22,1004,7576,1,
7586,that’s literally what i’m trying to do rn. please don’t be so condescending.,12/23/22,1004,7576,-1,
7587,"It’s like that joke:  

“What do you call the guy who graduated last in his class in med school?” 

Answer:  “*Doctor*”",12/24/22,1004,7577,1,
7592,thank you <3,12/23/22,1004,7579,1,
7593,"thank you so much. this was tremendously helpful.

coming from a shitty public high school as a top asian student, struggling in umich classes was a huge change. i think i really need to get into that mindset of “a C means you met competency level”. i’ve been reading some comments/reddit posts and watching videos, and i’ve calmed down significantly from when i made the post. it helps to know i’m not the only one feeling this way. thank you!",12/23/22,1004,7581,1,
7597,"i will, thanks!",12/23/22,1004,7582,1,
7600,"i just barely got the passing threshold for exams, which is a 50%… the average was around 70% so :/",12/23/22,1004,7583,-1,
7601,"I live by the motto, “Cs get degrees”

Totally get what you mean about the shitty high school and easily excelling, then all of a sudden you’re reaching for a C. It feels like you don’t belong at this school or give you imposter syndrome. 

You’re not alone, you’ve passed, and you will succeed!",12/24/22,1004,7593,1,
7604,"As a fellow half Asian who was a top student at a private school with shitty education (easy classes so grades look better to the board) & failed one of my classes my first semester at umich, I feel your pain. But I didn't let that stop me from achieving my goals, just graduated this semester with a 3.4 GPA despite the failure and a few Cs here and there. I was really losing it at first after failing, I honestly believed my entire life plan was over but I promise you, one C is not going to do anything to your future plans. You got this!",12/23/22,1004,7593,1,
7606,"This is huge. Many internships don't have a GPA requirement and some outright don't even ask for it at all when applying. You'll find much greater emphasis is placed on other areas of the resume. Don't worry at all about it, just make sure you're working to find ways to keep strengthening your skills and improving your resume!",12/27/22,1004,7597,1,
7607,"But you got the passing threshold. Most people, myself included, wouldn’t be able to do that",12/23/22,1004,7600,1,
7609,thank you <3,12/23/22,1004,7604,1,
7611,thank you.,12/23/22,1004,7607,1,
8157,I heard you have to look like kassadin to have a chance,2/2/23,1102,-1,-1,
8158,"Please try to wait until the class ends. There are several concerns.

1. During the class, teaching assistants are actually not allowed to develop relationship with students. This is a protection on you to make sure that the relationship is not ruled impropely by one part. This is a very serious rules of conduct that all instructors and teaching assistants need to follow. 
2. There is a case that a report is sufficient. If the teaching assistant and a student forms the relationship (either current or ex-couple) before the class starts, then TA needs to report it to the instructor. The basic idea is to avoid the interaction between this TA and this student.
3. From your side, really, you should keep in mind that it is IA's **job responsibility** to handle discussions and help you with the work. Please do think about whether your like is beyond his responsibility or not. I really recommend that outside of class, when you no longer have the TA-student relation with him, then think about if you really want to ask him out.",2/2/23,1102,-1,0,
8159,[Sounds familiar…](https://reddit.com/r/uofm/comments/puaxfn/deleted_by_user/),2/2/23,1102,-1,0,
8160,"Only after he's no longer your IA, and you've received your final grade.",2/2/23,1102,-1,0,
8161,"this should go without saying but this is all very sus

i would sternly warn my daughter to stay away but also tell me if anything happened

EDIT: like, if the people in this thread thirsting over a particular reddit username and that username are EECS students and an EECS IA respectively, then literally all of them are violating the sexual misconduct policy right now

EDIT2: CoE Instructional Aides receive job training about this and the supposed IA in this thread is not following their training

EDIT3: i stand by my assessment that UofM is the best CS program in the country, but like the federal government, it's still a prestigious institution that attracts bad actors who can do significant damage before they're brought to justice

there is a public record of [particularly infamous past EECS instructors using their positions to sexually victimize their students and coworkers](https://www.theverge.com/2020/2/13/21135765/clinc-ai-university-of-michigan-sexual-harassment-allegations-ceo-startup)",2/2/23,1102,-1,-1,
8163,"official ruling: it is not an issue. the IA just has to report it to their profs/dept, and make sure they are not in a position of power over u.

but 99% of the time i will say it’s a bad idea. they’re just there to do a job and get paid, and getting hit on is not part of their job description. ik some weird IAs who like the idea of dating their students, but that’s few and far between. 

just wait until the class is over.",2/2/23,1102,-1,-1,
8165,@Cliftonbeefy,2/2/23,1102,-1,0,
8166,MAX?,2/2/23,1102,-1,0,
8167,Least horny CS student,2/2/23,1102,-1,0,
8168,"Unless your name is Jason Turner or you’re Challenger, Maximos is not interested I’m sorry 😂",2/2/23,1102,-1,-1,
8169,anything for that A+ lmao,2/2/23,1102,-1,-1,
8171,😳😳😳 me????,2/2/23,1102,-1,0,
8172,You didn’t have to say it was 370 we already know you’re a Compsci major,2/2/23,1102,-1,0,
8174,Oh god not this again.,2/2/23,1102,-1,-1,
8175,"if it’s who I think it is, don’t ask him out lol I’ve heard some really shitty things about him",2/2/23,1102,-1,-1,
8176,Wait until the end of the course,2/2/23,1102,-1,0,
8177,Do not get Schlisseled,2/2/23,1102,-1,-1,
8178,Wait what? I thought romantic relationship is not university's right/business,2/2/23,1102,-1,0,
8180,"Only if they're no longer your IA.

If you were to start a relationship while they were the IA of a class you were in, they would have to immediately report it to the dean and would probably have to get moved to a different class. If they didn't, it would be grounds for removal from the University.",2/2/23,1102,-1,0,
8181,kassadin nerfs next patch though :/,2/3/23,1102,8157,0,
8182,Who the fuck lets idiots like this have a voice?,2/2/23,1102,8161,-1,
8183,"I think this post is targeted at me so I'll address your EDIT2.  


I have not been approached by this student so I don't beleive any action is needed on my end. You are correct that if they were to approach me I would need to report it, but that has not happened yet, so I am following the training. I'm confused about what you think I am doing wrong here, I am simply existing :/",2/2/23,1102,8161,-1,
8184,Ain't no way 2 stop the h0rny,2/2/23,1102,8167,-1,
8185,Jason Turner <3 https://www.youtube.com/watch?v=MdrfPSUtMVM&t=1591s,2/2/23,1102,8168,0,
8186,EvEn A LaP daNcE!?,2/2/23,1102,8169,0,
8187,something something max feet pics,2/2/23,1102,8171,0,
8188,"Well a lot of it is stuff I heard from friends who took the class last semester and I’m not rly comfortable saying anything when I’m not 100% sure if it’s true, but what I did hear wasn’t great",2/2/23,1102,8175,-1,
8189,Which IA 👀,2/2/23,1102,8175,0,
8190,😭😭 like….,2/2/23,1102,8175,0,
8191,Do not use umich email ids 😝,2/2/23,1102,8177,0,
8192,The university has a strict policy against relationships with people over whom you have supervisory authority. With faculty that means any undergraduate at all or any grad student in their program. With GSIs or IAs it means anyone in their section. With non-faculty staff it means anyone who reports to you and any student who works in your office. That policy was the reason Mark Schlisssl was fired last year.,2/2/23,1102,8178,0,
8193,is this a valid way to change my stats 250 lab section,2/2/23,1102,8180,0,
8194,"some minutes ago i posted

> [(◕‿◕)](https://scp-wiki.wikidot.com/scp-2521)

and the comment got intercepted by a filter(?)",2/2/23,1102,8182,0,
8195,[(◕‿◕)](https://scp-wiki.wikidot.com/scp-2521),2/2/23,1102,8183,0,
8196,you're not supposed to reciprocate when a student asks you for feet pics,2/2/23,1102,8183,0,
8197,Only if you ask nicely,2/2/23,1102,8186,0,
8198,🙃🙃,2/2/23,1102,8187,0,
8199,Honestly that's fair. I respect the integrity,2/2/23,1102,8188,0,
8200,So why say anything at all??,2/2/23,1102,8188,-1,
8201,"Well, that was the official reason. The University has covered up much worse before, so the board of regents obviously wanted him gone for other reasons. At least that's what my tinfoil hat tells me.

In all seriousness though, it's a good policy since it closes an easy avenue for abusive relationships.",2/2/23,1102,8192,0,
8202,I’m not in their section though,2/2/23,1102,8192,0,
8203,"If you have enough rizz, maybe. Either you'd swap sections or the TA would swap with a different TA

Give us a shot and let us know what happens?",2/2/23,1102,8193,0,
8204,"Is an obvious joke about feet pics then upside-down smiley emojis in response, all in a public Reddit thread, considered ""reciprocating"" these days?",2/2/23,1102,8196,-1,
8206,"If they were an nft, I’d give up my entire education to obtain them",2/2/23,1102,8198,0,
8207,"I agree that it was a multifaceted firing, but it was definitely a significant contributing factor rather than an excuse.",2/2/23,1102,8201,0,
8208,"It doesn't matter. They're in a position where they might be grading your exams, helping you in OH, teaching your discussion since 370 lets you go to whichever one you want, etc. which immediately makes it a weird power dynamic situation. It will be a huge headache for them and if not treated carefully could result in a lot of trouble for them, expulsion even.",2/2/23,1102,8202,0,
8209,Your asking them out will still make their life much more complicated. You will not be doing them any favors. Please just wait until you’re no longer a student in the course for which they’re working as an IA.,2/2/23,1102,8202,-1,
8210,"# yes


EDIT: i've gotten some replies from people whose comments were subsequently deleted so i'll respond here

to u/MonkeyMadness717, who said

> Please get off the internet

no, but i can make others",2/2/23,1102,8204,-1,
8211,"Bro got so upset that about a 5 word post that I deleted to try be nice that they edited their post and then tagged me lmao, you need to get a life",2/2/23,1102,8210,-1,
8212,Least delusional Reddit user,2/2/23,1102,8210,-1,
8213,[removed],2/2/23,1102,8211,0,
8214,hi,2/2/23,1102,8212,0,
8215,yo dude your kid got on your reddit account,2/2/23,1102,8213,-1,
8216,did you know that _remember the human_ is an allegorical autobiography,2/2/23,1102,8215,0,
8217,`it's morbin time`,2/2/23,1102,8215,0,
10712,I’m curious af how his first lecture will look 💀,1/13/23,1533,-1,0,
10713,Good.  If we don’t respect not guilty verdicts then there’s no point in even having trials and a court system,1/13/23,1533,-1,1,
10714,"The 'victim' in her own words said she didn't know if her allegations were true. I don't even understand how this went to trial. Doesn't seem like there was any actual evidence, unless I missed something.",1/13/23,1533,-1,0,
10715,I was a transfer student in 2020 and now I am graduating even with a master's degree. Didn't even have a chance to attend his lecture🤡. The closest one is 482 in winter 2021 but he left in just a week. What a loss.,1/13/23,1533,-1,0,
10716,What did he do?,1/14/23,1533,-1,0,
10717,Read the transcripts y’all. OJ was acquitted.,1/13/23,1533,-1,0,
10718,Absolutely pathetic.,1/13/23,1533,-1,-1,
10719,Apparently he was one of the best lecturers in EECS,1/13/23,1533,10712,1,
10720,"I am really curious if he will like just not acknowledge it at all, or if he’ll send some sort of email with a statement from him about it, or if the first lecture he gives upon his return he starts off with something like “soooo…elephant in the room….”

But I am glad that he is able to resume his duties and that (for the most part) students in general don’t seem too apprehensive about his return. He was found not guilty, after all - that has to be respected.",1/13/23,1533,10712,0,
10721,"Its somewhat disturbing that so many people who would outwardly say they don't trust the police would then also take their word as fact for merely charging someone.  


It would be nice if businesses would give 1st time felons a chance and fucking hire them. Yeah, not every felon for obvious reasons, but the automatic disqualifier for essentially every institution is what I mean.   


I was falsely accused by a coworker (who had relapsed at the time) of a felony he committed. He tried to implicate everyone around him in his life for a shorter sentence. The DA threw charges at pretty much everyone they could, see what would stick (which is a serious flaw in our justice system that could easily be fixed). If you're wondering, I didn't speak to the police without representation and nothing came of it. Everyone else plead out for lesser charges regardless of guilt. Mine was dropped at the first court date after arraignment.   


But I got a real good look of what life after a formal accusation/conviction would be like. It aint pretty. Even for people who didn't do something many would see as 'morally' wrong or was falsely accused. Essentially its life over, no decent job, no college or uni will take you, people will turn away from you from the stigma despite otherwise being friendly prior. Family who should be on your side will cut you loose. Its sickening.",1/13/23,1533,10713,0,
10722,"I will say that while I've not kept up on all of the specifics of the case (neither being in CS or on campus anymore), but there are fireable offenses that are not (or have a diffrent burden of proof than) criminal ones.

If this was strictly something that is in line with the criminal code, then I fully agree. We have a system of justice, it has worked out and he was found not guilty.",1/13/23,1533,10713,0,
10723,"In one way, if they didn't go through with it everyone would assume the University squashed it and doesn't take sexual assault seriously. At least students can take his class knowing he is convincingly not guilty. Bit of a silver lining in a shitty situation.",1/14/23,1533,10714,1,
10724,He was accused of sexually assaulting a young girl however in trial they decided there was not enough evidence so he was acquitted.,1/14/23,1533,10716,0,
10725,"Bruh, have you read the transcripts??",1/13/23,1533,10717,-1,
