id,body,date_posted,post_id,parent_id,sentiment_label,entities
10726,"Transcripts of the preliminary examination raised serious doubts about the accuser's recovered memories, and the evidence presented at trial was even more compelling. From the pre-trial preliminary examination testimony of the accuser:

>`Q: And at one point, you wrote a letter to your mom, dad, and ___ and you wrote about how Mr. Chen always put his hand on your shoulder, whispered in your ear, and touched your back, correct?`  
>  
>`A: Yeah.`  
>  
>`Q: In that very same letter, you said that you were having flashbacks, is that right?`  
>  
>`A: Yes.`  
>  
>`Q: And you said that you feel like you have something that had been locked away from your brain?`  
>  
>`A: Yeah.`  
>  
>`Q: In the letter, you explicitly say I do not know if this is true, meaning the sexual assault allegations with Peter Chen, correct?`  
>  
>`A: Yeah.`  
>  
>`Q: You wrote in the letter, I do not know for sure if he wanted to hurt me, is that correct?`  
>  
>`A: I don't remember the exact wording I used, it was a while ago, but yeah.`  
>  
>`Q: It's fair to say though that you wrote he was creepy and that caused your gut to say that he did something wrong, correct?`  
>  
>`A: Yes.`",1/13/23,1533,10717,0,
10727,OJ had solid evidence against him and was found civilly liable for the murder he was acquitted of.  The evidence against Chen is dubious at best and outright fraudulent at worst.  Irrelevant comparison,1/13/23,1533,10717,-1,
10728,I guarantee you if it was you that was accused of a crime with dubious evidence and found not guilty you would have a different opinion,1/13/23,1533,10718,-1,
10729,All EECS kids care about is that their stupid class will have a slightly better professor. Thats all they’ve ever cared about. The EECS 482 comments in the last thread were so horrifyingly tone deaf i expect this thread to be no better.,1/13/23,1533,10718,-1,
10730,If you want to downvote- go read the transcript.,1/13/23,1533,10718,-1,
10731,"Had him for EECS 482 back in '01.  He was one of my favorite profs, I was shocked when the allegations came out.

Dude knew everybody's name by the second class, and was probably the most helpful prof I ever had when it came to asking questions during office hours.",1/13/23,1533,10719,1,
10732,"He was, which made this whole thing way more difficult when it came out. I only had him for Eng 100 but day 2 he had the name of every person in the lecture hall memorized. Passionate, infinitely knowledgeable, and just a generally good dude. I believed the victims until the verdict but I am incredibly relieved that what came out was that the allegations were the product of recovered memory therapy, which is pretty well known to be garbage.",1/13/23,1533,10719,1,
10733,Yeah I heard that too. I’m rlly curious to see what happens with public sentiment in person AND see how good he rlly is at teaching.,1/13/23,1533,10719,0,
10734,"He is a ridiculously good teacher. The class he is known for, EECS 482 Operating Systems, is necessarily challenging. He presents the material in a way that doesn’t avoid the challenge but is very clear, interactive, patient and ultimately fair. It’s like exactly how you’d want a great professor to teach such a subject. Best taught and also most important class I took at UM.",1/14/23,1533,10719,1,
10735,"If we’re going to say that it’s totally fine for organizations to fire people just for being accused of crimes or civil violations, let alone people that went to court and were found not guilty or not liable, then it would be extremely easy for a person to abuse that by leveling false accusations with dubious evidence against a person they just don’t like.  Any exploit that can be abused will be abused

>inb4 OJ Simpson

OJ was found civilly liable for the murder he probably committed and was later arrested and convicted of armed robbery.  It was a fluke that’s not representative of our justice system",1/13/23,1533,10722,0,
10736,"I read the entire transcript and it is blatantly obvious that the correct decision was made. My brother had him as a prof and said he was one of the best at umich. It is shameful that bullshit coerced rape accusations from children can lead to permanent damage to someone’s reputation. I have a burning hate for those who will sacrifice the merits, reputation, and accomplishments of others for personal gain. Those responsible for these accusations are scum and deserve to rot.",1/13/23,1533,10725,-1,
10737,"I'd also note that the detective, Mark Fuhrman, who allegedly found evidence on OJ Simpson's property, was convicted of perjury for his testimony in the case. Recordings of Fuhrman were introduced in the trial of him describing different ways he'd lie and fake evidence, and how n-words didn't belong in Westwood. The alarming statements in those recordings were detailed and repeated. \[[link](https://www.mdcbowen.org/p2/bh/fuhrman.htm)\]

A primary reason OJ was acquitted, in my opinion, was proof during the trial that some of the police testimony was false, which cast a *reasonable doubt* on most of the rest of the evidence and testimony.

A primary reason Chen was acquitted, in my opinion, is that there was proof during the trial that some of the accuser's testimony was false, and besides that testimony, there was no good evidence that the alleged crimes occurred.",1/13/23,1533,10727,0,
10738,"You really think that EECS students are okay with child molesters walking free because they teach a class that maybe 25% of students end up taking? 

Also it’s not tone deaf at all to keep accusing someone of a heinous, life shattering crime they are found not guilty of by a court. Yep.",1/13/23,1533,10729,-1,
10739,Created an account today to make this comment? Welcome to U of M!,1/13/23,1533,10729,0,
10740,"False. Most people, including myself, had written him off as “seemed like a good person but actually a monster behind closed doors”, based on the accusation alone. However, the evidence turned out to be so incredibly flawed that we are comfortable assuming he is innocent. Under these circumstances, I don’t think there is anything wrong with talking about what a great professor he is.",1/14/23,1533,10729,1,
10741,"I read the pre-trial transcripts of preliminary examinations. The alleged victim's allegations were horrifying. But they were contradicted by facts and other testimony, and doubt was cast by the alleged victim's own questioning of what was real, and the circumstances under which the alleged victim's memories were ""recovered"".",1/13/23,1533,10730,0,
10742,"Memory is already one of the worst pieces of evidence, but it’s not even a he-said-she-said scenario. This “recovered memory” stuff is just nonsense.",1/13/23,1533,10730,-1,
10743,Calm down Karen,1/13/23,1533,10730,-1,
10744,Are the transcripts of the trial available?  I would love to read them.,1/13/23,1533,10730,0,
10745,"I am not disagreeing with you, at all, about Peter Chen. That said, I do think that you're overstating a few arguments and ignoring some crucial differences, as a general matter. 

""Beyond a reasonable doubt"" is not quantified in any U.S. court system (at least, none that I am aware of as a lawyer). For some jurors, ""beyond a reasonable doubt"" means they must be 90% sure that someone committed a particular offense; for others it may mean 75% sure. The only metric that everyone agrees on is that ""beyond a reasonable doubt"" is a stricter burden than ""preponderance of the evidence,"" which is just ""more likely than not"" in layman's terms. In other words, if every member of a jury is about 75% sure that a defendant committed a crime, and they all personally quantify ""beyond a reasonable doubt"" as something more than 75%, then the defendant will be found not guilty. In contrast, civil cases use the preponderance of the evidence standard. The U.S. civil system is based on the idea that ""more likely than not"" is sufficient to deprive people of their money or property. There's far more nuance here of course, but your OJ example is not an outlier at all. Again, this is an oversimplification, but if I (as hypothetical victim) can, in a civil battery case, prove with 50.000001% certainty that you punched me and caused me injuries, and a prosecutor can also prove that in a criminal case with the same 50.000001% certainty, then you would be liable to me for damages but face no criminal penalties. 

In terms of when someone should face employment consequences for being accused of a crime, I truly don't know what the correct answer is. But I certainty don't think that, if ""more likely than not"" is enough for one to lose money or property, then ""beyond a reasonable doubt"" is the only standard by which one can lose your job. Our criminal justice system is designed to ensure that the government is least able to punish the innocent, even if that means some guilty go unpunished. That same standard should not, and generally does not, apply to situations without the possibility of criminal sanctions—with the caveat that for Peter Chen, I understand a body of the government is the employer as well.",1/13/23,1533,10735,0,
10746,reasonable nuance on \*my\* reddit??,1/13/23,1533,10737,0,
10747,"Wow great strawman! Where and when did I say anything about Chens innocence/guilt? I stand by my comment whether or not he is innocent. All im trying to say is that it irks me the wrong way that some people are trying to reduce such a horrifying accusation into “LOL 482 SAVED LETS GOOOO LOL ROFL”

Also r/redpillwomen lmaooo

Nice one i was bored of just seeing r/conservative in y’alls history.",1/13/23,1533,10738,-1,
10748,Lmao I promise you no one outside of CoE even knows who Peter Chen is. The idea that im some sort of bad faith actor here to take him down is hilarious.,1/13/23,1533,10739,-1,
10749,"To be fair, and this isn't making any opinion on Chen, ""recovered memories"" is a very common phenomenon among children who have been sexually assaulted. This phenomenon can be proven with victims who have ""proof"" of their assault, ie video/photo evidence, and had no initial memory of the event or recovered their memories at a later date. It's a trauma response.",1/13/23,1533,10742,0,
10750,why are you supporting him?,1/13/23,1533,10743,0,
10751,https://docs.google.com/viewerng/viewer?url=https://www.michigandaily.com/wp-content/uploads/2022/12/21-328-FC\_Transcript\_of\_Preliminary\_Examination\_7-1-2021\_Redacted-2\_Redacted-2.pdf,1/13/23,1533,10744,0,
10752,"Lmao “great straw man” when you immediately follow it with a personal attack 😂

Also, you have a very pretty straw man yourself. Please show me where you saw EECS students saying “LOL 482 saved!!!”

Lastly, just because people disagree with you, doesn’t mean they are conservative. Sometimes you’re just wrong. 

(Also ew get a life and stop stalking people)",1/13/23,1533,10747,-1,
10753,An accusation that was horrifying because an innocent man was turned into a victim for a crime he didn’t commit….,1/13/23,1533,10747,0,
10754,You gotta be the biggest bonehead on this thread bro ☠️.,1/13/23,1533,10747,-1,
10755,"Yeah I noticed that too. But maybe look at it as a man’s career was saved and these comments are reflecting that. 

And from EECS students’ point of view the alleged nature of the crime is completely irrelevant to what he professionally delivers to them. So of course their interface is what they will care about.",1/14/23,1533,10747,1,
10756,">The idea that im some sort of bad faith actor here to take him down is hilarious.

Says the person who feels so compelled to make an account to post two comments accusing someone of utterly terrible crimes that they have been cleared of in the absence of sufficient evidence",1/13/23,1533,10748,-1,
10757,"Sometimes people forget and remember things, including trauma. Here’s a very sympathetic take -

https://did-research.org/controversy/repression/repressed_validity

Near the end it talks about a study where they tried to corroborate recovered memories and found -

“Many examples of corroborated recovered memories can be found at the Recovered Memory Project (Cheit, 1998; www.recoveredmemory.org). That said, the context in which the memories were recovered does matter. A study by Geraerts et al. (2007) found that 45% of survivors with continuous memories, 37% of survivors with temporarily inaccessible memories, and 0% of those who had recovered memories through suggestive therapy were able to obtain corroboration for their memories.”

Of course “not corroborated” doesn’t mean “false”, but 0% in the above study is pretty damning.

From the everything I’ve been able to gather from the trial it appears the accuser’s recovered memories surfaced as part of suggestive therapy, and she clearly had doubts that they were real.

So, in this case we are in the 1980s satanic daycare realm of recovered memories",1/14/23,1533,10749,0,
10758,"A jury of our peers found him not guilty. Plus, if you actually read the transcript, it’s clear the witness was manipulated into making her accusation by her therapist. Recovered memory is not a real thing. 

Why are you not supporting him? Should we be crucifying everyone who had a claim made against them, regardless of the fact that they’re not guilty of the claim? Like if I accuse you of stealing a million dollars from me, do you automatically owe me a million dollars?",1/13/23,1533,10750,-1,
10759,That is the preliminary examination.  Do you know if the trial transcripts are available?,1/14/23,1533,10751,0,
10760,Okay fine you got me i’m actually an OSU student who has been closely following the Michigan Daily for the past three years just for this singular moment so I can go comment in a reddit thread about a random professor I have never met.,1/13/23,1533,10756,0,
10761,I say those making false claims should absolutely be persecuted to the full extent of the law. I don’t understand how one can morally justify an attempt to completely destroy an innocent man’s career and overall standing in society.,1/13/23,1533,10758,-1,
10762,Honestly that'd make more sense than whatever this is,1/14/23,1533,10760,0,
10763,"I think everyone would agree when it's done intentionally. I believe that in this case, the accuser believed what they claimed, but that those claims were false. It would be inappropriate and unjust to punish her for delusional beliefs.

The accuser appeared to suffer from serious mental health issues, was a minor, and was held at an extreme ""wilderness therapy"" camp in Georgia for months when the memories in question were recovered. Here's a [recent article](https://www.usatoday.com/in-depth/life/health-wellness/2022/12/08/wilderness-therapy-troubled-teen-industry/9890694002/) on possibly related camps; I think the accuser went to one that regularly rebrands itself in this article, although it's difficult to trace camp lineages, I think intentionally. Many relevant details of what transpired there couldn't be revealed or asked about in the Chen case because of medical confidentiality, but informally it sounds like a sort of boot camp that applies extreme behavioral modification techniques to try and change unwanted behaviors that can occur due to mental illness or other issues. Some camp survivors come away allegedly suffering from PTSD. The practices in the case of the accuser seemed to include weekly therapy sessions using widely discredited techniques for creating and reinforcing recovered memories of sexual abuse. Again, defense attorneys were barred from asking about details, so that's speculative, but fits with the details that could be asked about in the preliminary examination transcripts.",1/13/23,1533,10761,0,
11127,Bruh,1/6/23,1749,-1,0,
11128,This is lowkey funny sorry,1/6/23,1749,-1,0,
11129,"a thought, but have your friend contact the professor/instructor of 250, and/or the instructor of record for the lab section, and give their case to get in. If they have not already.  


Instructors have wide latitude on waitlist, and can have override codes issued for down list students before the #1, etc, slot (if there is no dept-level policy overriding that) and can even go over capacity.

Might go nowhere, but it's a free option.",1/6/23,1749,-1,0,
11130,"Events unfold:

1. Finds person willing
2. Pays person and they drop.
3. Friend that's on wait-list at work or busy and get notification of opening, but doesn't see it right away.
4. Spot gets offered to next person in list which isn't ops friend because they didn't reply fast enough.
5. Op pissed that friend didn't answer quick enough costing them $150",1/6/23,1749,-1,0,
11131,oos students smh,1/6/23,1749,-1,-1,
11132,"You should confirm that the wait list works on a first come first serve basis. For instance, I know math majors get preference on the wait list for certain math department classes. Also, assuming there are physical seats left in the classroom (and often there are even when wolverine access says the course is full), either the stats department or the lab instructor should have the power to add your friend to the section regardless of their spot on the waitlist. Whether they're willing is another question though. Anyway your friend should definitely email both the instructor and the department about this, if they haven't yet",1/6/23,1749,-1,0,
11133,"This isn’t how it’s working. If your friend’s waitlist position is 1, then just wait for a few days. If the position is 9, then just give up. You can’t transfer your spot in class to somebody else. It goes to the waitlist position 1.",1/5/23,1749,-1,-1,
11134,Least desperate eecs student,1/5/23,1749,-1,-1,
11135,The Michigan Difference,1/5/23,1749,-1,0,
11136,Bro will hire a hitman if this doesn’t work out (it is more financially smart),1/5/23,1749,-1,-1,
11137,This is the most rich kid michigan crap of all time,1/5/23,1749,-1,-1,
11138,why can't your friend just enroll in a different stats course?,1/5/23,1749,-1,0,
11139,good luck my dude,1/5/23,1749,-1,1,
11140,This post shows how previleged umich is...,1/5/23,1749,-1,-1,
11141,"damn this is the type of Michigan ingenuity i love to see

hope it works out",1/5/23,1749,-1,1,
11142,I already have.  Unfortunately they said just wait.,1/6/23,1749,11129,-1,
11143,I loving coding $150 too,1/6/23,1749,11130,0,
11144,I'm from Michigan...,1/6/23,1749,11131,0,
11145,"This sounds like a trollish joke, but treating it as serious for the sake of argument:

I think OP is saying they're willing to pay multiple people to give up their spots so their friend moves up the list a notch each time, with payment just to drop the course or lab, not contingent on the friend getting in. Otherwise it would be a ridiculous gamble to drop the course for a low chance of getting $150.

However, I still view the amount offered as absurdly low relative to the cost of attending the university. If you're paying $20k-$40k per semester to attend U-M, one might value that 4 credit hour course at $5k-$10k of that $20k-$40k. It just seems dumb for a measly $150, unless you could switch to a nearly equally good alternative course.",1/5/23,1749,11133,0,
11146,Yes but the waitlist only has 4 people on it which combined with people (hopefully) naturally dropping limits the amount I would have to spend.,1/5/23,1749,11133,0,
11147,"Lmao you tryina coerce them into doing it?

&#x200B;

Hey orr you can just go do it yourself (even more financially smart, wont cost you a thing. Do it. Snap they neck. Do it.)",1/6/23,1749,11136,-1,
11148,"No, the pinnacle is when they pay students for their dorm on central.",1/6/23,1749,11137,0,
11149,They are numerically challenged and need it to apply to for a certain program.,1/5/23,1749,11138,0,
11150,Having more than $150 in your bank account makes you privileged?,1/6/23,1749,11140,0,
11151,Really weird how u call this person privileged when you have no idea how this person made their money.,1/6/23,1749,11140,-1,
11152,Chill tf out lmao,1/5/23,1749,11140,-1,
11153,"Sorry for working and contracting on the side enough to afford expenditures like this.  For reference, I have 5 siblings, pay my own tuition, and my life savings before I started working (age 17) were about $2500.  I'm not a Horatio Alger character by any means but I'm probably in the 30-40th percentile of privilege here.",1/5/23,1749,11140,0,
11154,"sorry to hear, but not a surprise. two of my grad students GSI's STATS 250 about 4 years ago (we are not in statistics, but they needed GSI's and my students wanted the chance to teach at that level), they said that it was very ""industrialized"" course - pretty strict structures, SOPs, etc.",1/6/23,1749,11142,0,
11155,C:run_fixspell,1/6/23,1749,11143,0,
11156,But it’s daddy and mommy who pay their tuition. Seems like a good idea to have $150 free money into one’s own pocket.,1/6/23,1749,11145,-1,
11157,"Bro is ready to spend $600 for a spot in a class

😔",1/8/23,1749,11146,0,
11158,Fuck bursley though,1/6/23,1749,11148,-1,
11159,What does that mean,1/6/23,1749,11149,0,
11160,[deleted],1/5/23,1749,11152,0,
11161,How much would you give to help an economically disadvantaged friend get into a program that would be good for their career?  I didn't see anyone complaining when a bunch of California rich kids were offering thousands of dollars to switch dorms with people on Facebook.,1/8/23,1749,11157,-1,
11162,Their friend is an idiot.,1/6/23,1749,11159,-1,
11163,"I mean I referreed soccer (gameofficials.net xd) and wrote IT tutorials for hosting companies since I was like 14, didn't mention that since I didn't make very much doing it compared to everything after that. Sorry if I came off as abrasive.",1/5/23,1749,11160,0,
11164,"ah, but like why does the section matter? does a certain section like puppet you into clicking the right buttons on the calculator?",1/6/23,1749,11162,0,
11165,"thinking it’s so that their friend can copy off them for exams, since for big classes you take exams with your section",1/6/23,1749,11164,-1,
11166,"Has nothing to do with that.  I did STATS 412 (not 250) this fall, this is just the easiest course that satisfies a requirement they need to meet and the waitlist was relatively small compared to alternatives.  They need a certain section because lecture has many open slots but labs are all full so they are only waitlisted for the lab.",1/6/23,1749,11165,0,
11167,"Idk, having taken 412 that might actually be easier than 250",1/6/23,1749,11166,1,
11168,ohhh that makes more sense,1/6/23,1749,11166,1,
12227,"My parents covered me, so 0. Otherwise I'd be at -$40k.",3/4/23,2028,-1,0,
12230,"75k, been paying on it for 4 years and it’s just now under 60k 🥲",3/3/23,2028,-1,0,
12232,0,3/3/23,2028,-1,0,
12235,0 bc my dad put money aside for my college. but i’ll be about 45k after grad school (public health mph) bc i used all the money in undergrad (neuroscience bs),3/3/23,2028,-1,0,
12240,"Didn’t have much for undergrad, close to 100k for grad school tho 😢",3/3/23,2028,-1,1,
12243,I think I'll make around 20k by going to school here,3/3/23,2028,-1,0,
12247,Around $30k. In-state,3/3/23,2028,-1,0,
12249,"my freshman year expenses were almost covered by scholarships, but after that I would have been shit out of luck; I would have paid about 30 grand a year, so 90 grand in debt by the end. however, I got married that year (specifically for the financial aid), so now the go blue guarantee covers everything. now all I have in debt is about 5500 from my freshman year. would highly recommend getting married lol",3/3/23,2028,-1,1,
12253,finished undergrad here ~30k will unfortunately finish grad here with in total ~50-60k,3/3/23,2028,-1,0,
12261,0; gbg clutch fr,3/3/23,2028,-1,0,
12264,65k,3/3/23,2028,-1,0,
12267,I assume it's going to be around between 10-15k.,3/3/23,2028,-1,0,
12269,"joined the national guard and deployed in the middle of it so should have +-$50k in the bank after (parental help with housing and covid helped)

\+will also knock $100k off law school COA because of post-9/11 gi bill

crazy part is if I was OOS i would've saved probably close to $100k more on undergrad too because military gets you in-state tuition",3/3/23,2028,-1,0,
12272,Was about 11k,3/3/23,2028,-1,0,
12273,Probably a net positive from on-campus jobs and the weird returns I'm getting. (on full ride and in state),3/3/23,2028,-1,1,
12274,"~20k, engineering degree, OOS",3/3/23,2028,-1,0,
12275,24k so on the lower end. If the SC could you know be on our side it'd be 4k. Stressful times. Makes me almost regret going OOS to escape my toxic family.,3/3/23,2028,-1,-1,
12276,"Well it would’ve been 28k; but because of a bumpkin sycophant judge from Texas, and a bunch of other sycophants in the supreme court, it’s around 48k.",3/3/23,2028,-1,-1,
12277,Close to $9k possibly,3/3/23,2028,-1,0,
12278,"I had around 30-35k when i graduated. I found in my convos somewhere around that 30k mark was pretty common for out of state undergrad degrees about 7 years ago. For prespective, my monthly payments were around $350 a month for a 10 year plan. Of course interest rates play a big factor in that.",3/3/23,2028,-1,0,
12279,"33k. 

Lost my financial aid in my final year because I became a double-major.",3/3/23,2028,-1,0,
12280,Around 20k.,3/3/23,2028,-1,0,
