id,body,date_posted,post_id,parent_id,sentiment_label,entities
12281,"I’m an out of state engineering student alum. Graduated with ~$40k real debt to the government, but candidly my parents covered like $120k or something bananas for me over 4 years - so somewhere near $160k total “debt” including what I feel I owe them back. 

I’m incredibly privileged, the ROI has easily proven itself since I work in tech, and now I just gift my parents like $5k a year until it’s time for me to pay for my own children’s college",3/3/23,2028,-1,1,
12282,~30k,3/3/23,2028,-1,0,
12283,0,3/3/23,2028,-1,0,
12284,0,3/3/23,2028,-1,0,
12285,Negative 60k? School for profit,3/3/23,2028,-1,-1,
12286,around 80k,3/3/23,2028,-1,0,
12287,"120k for undergrad, 170k if I do sugs",3/3/23,2028,-1,0,
12288,"0, thank god for Go Blue Guarantee..",3/3/23,2028,-1,1,
12289,16k,3/3/23,2028,-1,0,
12290,I’m coming out with a net positive. The only time I’ve been glad that I’m poor 😎.,3/3/23,2028,-1,1,
12291,"Graduated with $15k, CS degree, in-state",3/2/23,2028,-1,0,
12292,280k lol. Thank you UMich,3/2/23,2028,-1,0,
12293,Why did everyone upvote 0 and nothing else 💀,3/2/23,2028,-1,0,
12294,25k,3/2/23,2028,-1,0,
12295,~200k,3/2/23,2028,-1,0,
12296,15 grand,3/2/23,2028,-1,0,
12297,15k,3/2/23,2028,-1,0,
12298,Finished with ~20k,3/2/23,2028,-1,0,
12299,~155k,3/2/23,2028,-1,0,
12300,0,3/2/23,2028,-1,0,
12301,~60k,3/2/23,2028,-1,0,
12302,Can you explain how getting married helps?,3/3/23,2028,12249,0,
12303,"That’s odd. I was also a double major, took a full double course load every semester (summer included) for two years and never lost aid.",3/3/23,2028,12279,0,
12304,Hey can you explain a bit more about how your double major affected your financial aid? Was it because you had to take another semester or something?,3/3/23,2028,12279,0,
12305,Omg be a gsi and do sugs for free,3/3/23,2028,12287,1,
12306,"how much aid did you get if you don't mind sharing? I'm in state and both my parents are unemployed so my official EFC from FAFSA was 0, I still had to pay like $1500 a semester for tuition and all rent etc was on me. Graduating w minimal debt but that was largely due to pretty high paying internships.",3/3/23,2028,12288,1,
12307,"copying this from another comment but how much aid did you get if you don't mind sharing? I'm in state and both my parents are unemployed so my official EFC from FAFSA was 0, I still had to pay like $1500 a semester for (upper level, so everything starting sophomore year onwards) tuition and all rent etc was on me. Graduating w minimal debt but that was largely due to pretty high paying internships.",3/3/23,2028,12290,0,
12308,How would you even begin to pay that off?,3/3/23,2028,12292,-1,
12309,A little less than half of all undergraduate students in the US graduate with zero debt.,3/3/23,2028,12293,0,
12310,A lot of people might be agreeing with that one because a lot of low income in state tuition get a lot of help thru go blue guarantee so they might also have 0 debt,3/2/23,2028,12293,0,
12311,"Mine will be about the same, coming from a UC",3/3/23,2028,12294,0,
12312,"do you think it was worth it?
(genuine question)",3/3/23,2028,12295,0,
12313,How ? Why?,3/3/23,2028,12295,0,
12314,Bruh,3/2/23,2028,12295,0,
12315,"same, thanks to my parents",3/3/23,2028,12300,0,
12316,[deleted],3/3/23,2028,12301,0,
12317,"Wild, I exchanged letters between the office and my academic advisors too. There were multiple signed documents submitted requesting that I still receive my financial aid. The financial aid office still said no after initially saying that my financial aid wouldn't be impacted by declaring a double major.",3/3/23,2028,12303,0,
12318,"Yes and no. I took far more than 120 credits. I graduated with 1 credit less than the maximum credit allowance for financial aid (179 out of 180 allowed credits). I also transferred into UofM with 60 credits that were useless but still counted against me when it came to financial aid.

Prior to double majoring, I met with the financial aid office staff and my academic advisor to ensure that my financial aid wouldn't be affected if I declared a second major. All of them said that I would be fine so long as I met the requirements for financial aid- and I did. As soon as I declared a second major, my University of Michigan Grant was taken away because I was only allowed to satisfy academic requirements for one major.

I did ask the financial aid office if I could receive financial aid again if I revoked my second major but was told no because I had already taken classes for the second major. I had started taking classes for my second major during the winter term; therefore, my financial aid was impacted for the following year.

I ended up going from 24-27k a year in financial aid with the University of Michigan Grant to a 5k Pell Grant + student loans. I thought about dropping out because I didn't want the debt but I had already accumulated so many credits (and I suffered through years of full-time employment with 16-18 credits as a poor first-gen student).",3/3/23,2028,12304,-1,
12319,I want to but it’s super hard to get a position as a master’s student doing 1 year…,3/3/23,2028,12305,-1,
12320,Everything is covered but books and living expenses for me. I’m an older transfer student so my own income is the only thing that is factored in.,3/3/23,2028,12306,1,
12321,Dayum I’m also in state and got a juicy refund from the U. I basically got enough to not pay anything for rent tuition or food,3/3/23,2028,12307,1,
12322,Lol. That’s a good question. Haven’t accept the offer yet. (I’m a senior in high school). Going to with financial aid office in person soon,3/3/23,2028,12308,1,
12323,How much do they give you for a kidney?,3/3/23,2028,12308,0,
12324,and because lots of people at this school have rich parents so they don’t have to take out any loans LOL,3/3/23,2028,12310,-1,
12325,Didn’t consider that they were agreeing. That makes sense,3/3/23,2028,12310,1,
12326,yeah debt is just an asset,3/3/23,2028,12312,0,
12327,"Paying that out of state tuition, plus room and board out of pocket is no joke, but the loans would drown anyone",3/3/23,2028,12313,-1,
12328,out of state tuition can be 70k or more without aid or scholarships,3/3/23,2028,12313,0,
12329,I find it difficult to believe raising 9 off 50k is doable without assistance. You won’t be able to pay it off in 10 years making only 50k.,3/3/23,2028,12316,-1,
12330,"No one should take out loans more than they  can make their first year out of school. Two, max. Is a good guideline. I also have no clue where your parents took care of all those people for $50k a year. You literally just said rent is $12k a year for a person in college, but you could make food and rent for $14000? You’re going to spend less than $200 a month on food? Where? Payments on $200k in student loans alone is $2200 on a 5% loan over 10 years, which is the best case scenario I just looked it up and those payments can wildly range to much higher too. Health insurance for a family of four has cost me $1200-$1500 a month for the last 20 years. If you think you can live on $50k a year when a dozen eggs is $9, it’s about to be rough for you.",3/3/23,2028,12316,-1,
12331,"For curiosities sake, what program were you in?",3/3/23,2028,12317,0,
12332,"I wouldn’t say its super hard, I and many of my peers did it. Reach out to your favorite profs and float the idea. You can also get it waived if you do research, but that wasn’t my jam. 

As someone out in the workforce I am confident that you will feel the extra 50k and be upset with yourself for not putting in the effort to get u of m to pay your way.",3/3/23,2028,12319,1,
12333,"Depends on your department, it’s at least worth asking staff to see. Nobody can make promises though so there’s an inherent risk of you otherwise wouldn’t do SUGSS. But I know in some deptartments SUGS students are the most likely Master’s students to get a GSI because you’ve actually taken the classes.",3/3/23,2028,12319,1,
12334,"ah ok so full tuition? that's a lil more than I got but sounds about the same, gotcha",3/3/23,2028,12320,0,
12335,"It's definitely not worth it unless you plan on living a very spartan lifestyle while you work for a nonprofit or government agency for 10 years. And if you do that route, you might as well join ROTC that way you are only on the hook for 4 years after graduation.",3/3/23,2028,12322,-1,
12336,For the love of everything do not go almost 300k in debt just for an undergrad. That’s ridiculous. You’ll never be able to pay it off or even make the payments.,3/3/23,2028,12322,-1,
12337,Do not go 280k in debt. You will practically ruin your life,3/3/23,2028,12322,-1,
12338,Dunno why ppl downvoted but yea u should definitely do that lol,3/3/23,2028,12322,1,
12339,"It's illegal to sell a kidney in the US.

Abroad... I really wouldn't risk that unless you're suicidal, but 10–20k.",3/4/23,2028,12323,-1,
12340,That is not an unreasonable question to ask in this scenario.,3/3/23,2028,12323,1,
12341,"???? am I being obtuse and this is some sort of meme? but for everything else, debt is by definition not an asset. It is the opposite of an asset; it's a liability.",3/3/23,2028,12326,-1,
12342,That's the spirit! You're gonna have such a huge tax deduction from the interest you pay!,3/3/23,2028,12326,1,
12343,That's how it was going to be for me. Got accepted into the nursing program with a 10k/yr scholarship but it was still gonna be bonkers since I was oos.,3/3/23,2028,12328,-1,
12344,"Biomolecular science (BMS) and biopsychology, cognition, and neuroscience (BCN). I intend on going into a UK medical school for psychiatry or a masters program for genetic counseling (or both, I'm very indecisive).",3/3/23,2028,12331,0,
12345,"I don't think it's impossible but it is hard. For my department there's something like 250 grad students and really not nearly that many classes. I've had friends do random stuff like be physics GSIs but that's even more rare. Sure, do email your profs and try to get a position, but don't assume it will happen for you. My 3.98 (raw, no p/f covid classes, if that matters) GPA BF with several internships etc got a position during the first week of school in September for EECS 215, then they replaced all the GSIs this semester with PhD students (and it's currently a dumpster fire from what I've heard, lol). He got great reviews from all his kids too and they just didn't care.",3/3/23,2028,12332,0,
12346,"Because it's so unbelievably stupid to go 280k in debt for an undergraduate degree? There's got to be somewhere else they can go in-state where they live. 

Even on a federal loan, you'd accrue 14k in interest a year without touching the principal.",3/4/23,2028,12338,-1,
12347,"It's a depressingly small amount. I have about 270k total from vet school and according to my extensive drunk googling shit around graduation day, a black market kidney will only earn you about 10k.

And it's apparently illegal to sell your own organs, even as a consenting donor.",3/3/23,2028,12340,-1,
12348,Definitely a joke.,3/3/23,2028,12341,0,
12349,"That still halves his grad debt if its sugs! Which is huge. The same thing happened to me with eecs 230. 
Theres a difference between actively trying and just saying its too hard to try and committing to 170k for a public school. I would have a working relationship with your profs and actually talk to them in their office, not just send an email.",3/3/23,2028,12345,1,
12350,"He doesn't have debt anyway (I'm jealous) but yes it is a lot less money that he & his family needed to pay. I agree that you should try and you're right that working relationships help but my main point is I think that expecting to get a GSI position even if you have a strong background is not realistic and you should plan your finances around not getting a position. Many many positions go to former IAs, PhDs, and/or people in the prof's lab.",3/3/23,2028,12349,1,
12351,"The thing about sugs is you have the opportunity to be that IA and member of research lab before starting your masters. Taking advantage of those opportunities *is* adding flexibility to your financial plan when it comes to investing in education. 

If one has no interest in hustling for those types of opportunities either in bachelors or +1 masters I question how much value they’re really going to get out of their masters degree. Anyone has the freedom to go into hundreds of thousands of debt for umich, obviously. But everyone on the other side in that boat that i know personally regrets it immensely. I’ll always encourage being creative and seeking out way to reduce your debt so that you can start “adulthood” off much more comfortably.",3/3/23,2028,12350,1,
12352,"I spent my undergrad focusing on things like project teams, which was overall beneficial because it landed me sweet internships but in hindsight I probably should've IAed something too. Doing SUGS has also been beneficial for me even though I'm leaving with 50k in debt because it definitely opened doors to better jobs for me. I'm frankly not very stressed about paying it off but I'm sure I would be if it were significantly more than that. There's a lot of resources to take advantage of in your time here, not all of them end up with you being a GSI.",3/3/23,2028,12351,1,
12353,Different situation than 170k :),3/3/23,2028,12352,0,
14409,"Hi. CS can be a slog but it is a gateway to a lot of different pathways...not just coding. 

I have worked with CS majors who have become Product Managers in tech, consultants at MBB/Deloitte/Accenture/etc, investment bankers, so there are a lot of options. Why employers like CS majors (besides wanting coders) is that they are very analytical and solutions driven. So do you need to stay in CS? No. If you hate it, switch. IOE has the same type of opportunities but could be more physical. What do you want to learn more about? How do you want to apply your knowledge? What problems do you want to solve? 

Maybe answering those questions can help you have the conversation with your parents.",2/22/23,2241,-1,1,
14411,"If you’re considering moving out of CS, I recommend CE (Conputer Engineering). You don’t need 376 and if you did well or understood 370 that’s a strong start to being a CE. I am a CE and I absolutely love it, not all code but a lot of code, no theory, and I get to build cool things with microcontrollers and stuff.",2/19/23,2241,-1,1,
14413,"Anyone can program without a CS degree. What sets you apart from a typical code monkey is that CS degrees are good for doing research in the field of CS, so maybe something like that would interest you more? You could also try programming different things to keep you interested, maybe you found desktop applications boring to program but IoT/embedded systems might be more fun (and in fact, they are!)",2/19/23,2241,-1,1,
14415,Have you considered switching to EE? Still get to do a lot of programming but less theoretical in the computer science sense and wouldn’t be too hard to switch with the credits you already have,2/19/23,2241,-1,1,
14416,"So long as you haven't yet graduated, it is never too late to switch majors if you discover you hate what you're doing.  Once you leave here, you'll be stuck in a career for 40 or 50 years.  Why would anyone want to commit themselves to a career they hate?

Steve Jobs got it right in his commencement address at Stanford.  If you'd like to do great work, you must find what you love and do what you love.  If you haven't found it yet, don't give up, keep looking.

You'll need to figure out a new plan.  But that's not impossible and it's way better than getting stuck in a career you hate.  If you haven't taken any humanities or STEM outside of CS, now would probably be a good time to look around.  Maybe you'll decide after looking around that you were just feeling frustrated and that CS isn't so bad after all.  Good luck.",2/19/23,2241,-1,1,
14418,"Haven’t taken those classes yet so I cant give great advice, but from what I heard 281/376 are both very hard and frustrating classes. I don’t think now would be a great time to quit. Id take 1 more semester of ULCS classes before you make that decision",2/19/23,2241,-1,-1,
14420,"376 blows. 281 is really hard if you don’t have a lot of time to commit to it. After these it gets easier though. I think 376 was the most frustrating of the core classes. 

Also life as a software engineer is nothing like school and every company is different, it is so much easier. Those core topics of computational complexity and algorithms makes for an excellent data scientist/analyst, data engineer, network admin, etc … too. 

That said no one can know if it is right for you except you.",2/19/23,2241,-1,-1,
14422,"You sound like me a few years ago. I very seriously considered switching. But I decided to stick through with it and work is honestly so much better. I barely use the things we do in the school 💀 so don't worry, you likely won't be needing to apply 376 concepts on the daily. You might need 281 a little more but honestly, depending on the job/company you end up with ¯\_(ツ)_/¯  its a toss up. 281 though - you start to get really good with debugging and googling which helps as you go to ULCS and into the workforce. 

The way I approach jobs is that as long as its not something you'll want to gauge your eyes out doing on the daily, that's good enough because you have the rest of your day to enjoy doing what you want to do! CS was one of the only things I saw for myself as something I wouldn't hate but also I could get good money and have time.for myself to do what I really want to do. 

I think it's worth evaluating if you're done with CS or just burnt out. University is killer and work is way easier because at least you have a defined start and stop time. I think either decision won't be a wrong decision though! In an alternate universe, I switched to IOE and who knows, maybe I'm happier. I believe in your ability to make the best decision for yourself! I just wanted to provide my experience since I was in your exact shoes before :)",2/19/23,2241,-1,1,
14425,"I disliked 376 very much when I took it, barely passed and then hid the grade with Covid P/F. 

Then, I don’t know why, but I decided to take 477, which is essentially 376 on crack and an introduction to theoretical CS. Completely proof based theory class, no coding, just lots of algorithms and induction. I loved it and ultimately got an A in that class. 

What I’m trying to say is that some mid-level classes are not taught in the best way, by lecturers that don’t have that topic as their main research focus and therefore couldn’t care less about it. Most CS students think 376 is ass, and 281 is hard. Although this could be an indication that you dislike CS in general, it could also be you going through the same rough patch a lot of  CS majors also went through.",2/19/23,2241,-1,1,
14427,"Talk to the IOE undergrad advisor. You might be able to count some CS things towards various forms of elective and breadth credit, and having more programming experience than just the mere basics, or even a CS minor, can make your IOE degree more marketable, too. 

But think before you leap; changing a major twice is definitely going to set you back. Have you taken any IOE classes? You can sneak in several classes from another department, including IOE, as flex tech electives for CS major.",2/19/23,2241,-1,1,
14430,"Industry SWE produce about 3 lines of new code per day on average

When you are working with code, you will spend about 70% of the time reading and understanding code that’s already been written.

Fact is, Microsoft don’t hire you to write a new word. They want you to keep the old word and all its 20 year old code going. If you think debugging 281 is hard, imagine debugging an issue in Excel. Oh and that’s if you manage to reproduce the issue at all

Food for thought

Sophomore year is certainly not early for switching major but it’s certainly not too late. I mean with how much you’ve done you can pick up a CS minor easily",2/19/23,2241,-1,0,
14431,"Switch to ioe, it will make your life honestly at least 35% better",2/19/23,2241,-1,1,
14434,It sounds like you don’t enjoy computer science. This is what software development is and the upper level classes and post grad working is going to be the same if not more so. You’re not that far into the computer science curriculum so you could probably switch to something else and have most of your credits work for you. Talk to an advisor in ioe and see what they say about it. I’m sure they’ll be able to give more specific advice and let you know how long it’d take you to graduate.,2/19/23,2241,-1,1,
14437,"I'm also taking 281 and 376, plus 370. 376 really is such a fxcker after the algo chapter ended, but I'm feeling like things will get better once this stupid computability chapter is gone.",2/19/23,2241,-1,-1,
14440,I haven’t taken 370 yet. How would you say it competes to say 281?,2/19/23,2241,14411,0,
14445,I wouldn't say that you'll become stuck in a career for 40 or 50 years if you ended up majoring in something you didn't love. Most people don't even end up working in the field they did their undergrad in. You're only stuck if you think you're stuck!,2/20/23,2241,14416,1,
14446,Line of code per day varies by company but as an entry level it should be ~70 lines on average with the harsher code quality requirement than school projects,2/21/23,2241,14430,0,
14449,">post grad working is going to be the same if not more so

Nah, not really tbh.  Lots of frustrating problems at work, but if we run into walls, we get peers/more senior folks to help us out without having to wait for 3 hours (which is common in EECS OH) - or we drop it.  Also, work ends at work.  I'm not having sleepless nights.  I hated this part of EECS classes.  The same pressure and frustration largely doesn't exist in the industry.",2/19/23,2241,14434,-1,
14451,"Damn, that’s quite a tough schedule. I can barely handle 281 and 376 here",2/19/23,2241,14437,-1,
14454,"I don’t want to be the bearer of bad news but the complexity chapter is more difficult than the computability chapter, however it does get easier with randomness and cryptography. 

And too, the user above. Put it in perspective of how maybe you have much more freedom once you get to the upper electives. You can choose whichever path/classes you want to take that have much lighter workload than eecs 281 that seem more interesting (I.e. eecs 492, eecs 486, eecs 493). I’m interested in the low-level side of coding/theory side of coding so I’m taking Operating Systems, compiler construction, gpu parallel programming, etc, and algorithms.",2/19/23,2241,14437,-1,
14457,It’s def less work and way different content-wise. I personally liked both but it’d be a good way to find out if maybe you like hardware stuff more.,2/19/23,2241,14440,1,
14460,"I agree with that.  But if there's something else you'd like better, isn't now, while you're still a student at Umich a really great time to get a hard start on it by majoring in and get good at that something else rather than wasting your time on something you don't like?

My real point about 40 or 50 years is that it's a long time compared to how you'll be a college student. Even if you have to add an extra year to graduate because you changed majors and had to start over, if that gets you a degree in something you'd actually like to do with your life versus something you don't, that is a pretty good move.",2/20/23,2241,14445,1,
14463,"Yes, but I enjoy the material a lot more so the workload and projects and material don’t feel as monotonous/tedious/long/difficult to learn/do. I took math 423 and math 351 at the same time, and math 423 is supposed to be “easier/less workload” than math 351, but I ultimately succeeded/performed better in math 351 because I enjoyed the material a lot more than math 423. Just have to find your passions which I think is the key to success.",2/19/23,2241,14451,1,
15286,I didn’t take it here but I heard the complaints about math 217(proof based linear algebra) were mostly because it was inquiry-based learning(which is another word for no lectures).,2/15/23,2339,-1,-1,
15288,"I’ve taken all 3 and calc 3 and Lin algebra are really hard but very rewarding. Discrete was very difficult for me and I didn’t really enjoy it but it did teach me a lot about proofs that I then needed in Lin algebra. I decided to take all the classes here at Umich cause I wanted to challenge myself and as an out of state student I felt I wanted to take the challenging courses here where I’m paying so much money. 

Linear algebra was one of my favorite courses here (Math 217 not the engineering version 214) it is extremely difficult but really pushes you to think about the problems and their application and is very collaborative. I had Scott Schneider as my professor and he was the best. 

Calc 3 was just interesting in the problems we solved and how rewarding it feels if you actually get something right. 

All in all if you choose to take the classes here, go to office hours! I cannot stress office hours enough, the homework is so much easier if you go as they can walk through problems with you and give you many hints. I went at least once a week for all those classes. They’re not impossible classes and there is a ton of support available for them if you have the time to use it. I’m glad I took them here, but everyone is different. :)",2/15/23,2339,-1,1,
